{
  "$schema": "http://json-schema.org/draft-07/schema#",
  "title": "Saudi Property Coding Systems",
  "description": "Schema for validating Saudi real estate property identification and coding system entries in data/property-coding.ar.json",
  "type": "array",
  "items": {
    "type": "object",
    "additionalProperties": false,
    "required": [
      "id",
      "system_name_ar",
      "system_name_en",
      "issuing_authority_ar",
      "definition_ar",
      "definition_en",
      "structure_ar",
      "usage_ar",
      "mandatory_in_ar",
      "digital_platform_ar",
      "source_url",
      "last_verified",
      "audience"
    ],
    "properties": {
      "id": {
        "type": "string",
        "pattern": "^[a-z][a-z0-9_]*$",
        "description": "Unique snake_case identifier"
      },
      "system_name_ar": {
        "type": "string",
        "minLength": 3,
        "description": "Official Arabic name of the coding system"
      },
      "system_name_en": {
        "type": "string",
        "minLength": 3,
        "description": "Official English name of the coding system"
      },
      "issuing_authority_ar": {
        "type": "string",
        "minLength": 3,
        "description": "Authority responsible for issuing or managing this system"
      },
      "definition_ar": {
        "type": "string",
        "minLength": 20,
        "description": "Arabic definition of the coding system"
      },
      "definition_en": {
        "type": "string",
        "minLength": 20,
        "description": "English definition of the coding system"
      },
      "structure_ar": {
        "type": "string",
        "minLength": 10,
        "description": "How the code is structured"
      },
      "usage_ar": {
        "type": "string",
        "minLength": 10,
        "description": "How this coding system is used in practice"
      },
      "mandatory_in_ar": {
        "type": "array",
        "items": { "type": "string" },
        "minItems": 1,
        "description": "Contexts where this code is mandatory"
      },
      "digital_platform_ar": {
        "type": "string",
        "minLength": 3,
        "description": "Digital platform or system where this code is used"
      },
      "source_url": {
        "type": "string",
        "format": "uri",
        "description": "Official URL for this coding system"
      },
      "last_verified": {
        "type": "string",
        "pattern": "^[0-9]{4}-[0-9]{2}-[0-9]{2}$",
        "description": "ISO 8601 date of last verification"
      },
      "audience": {
        "type": "array",
        "items": { "type": "string" },
        "minItems": 1,
        "description": "Target audience"
      }
    }
  }
}
