[
  {
    "id": "deed_number",
    "system_name_ar": "رقم الصك العقاري",
    "system_name_en": "Property Deed Number",
    "issuing_authority_ar": "وزارة العدل",
    "definition_ar": "معرّف رقمي فريد يُصدره كاتب العدل عبر منظومة التسجيل العيني للعقار (ريدز) لكل صك ملكية عقارية. يُشكّل الرقم الوحيد والحجة القانونية لإثبات الملكية في المنظومة الرسمية السعودية، ويحتوي الصك على بيانات العقار الكاملة من الموقع والمساحة وحدود الأرض وصاحب الملكية.",
    "definition_en": "A unique numerical identifier issued by the notary public through the Real Estate Electronic Registration System (REDS) for each property title deed. Represents the sole official legal proof of property ownership in Saudi Arabia's formal system, and contains complete property data including location, area, land boundaries, and owner identity.",
    "structure_ar": "رقم صك متسلسل مرتبط بسجل التسجيل العيني الإلكتروني، يتضمن بيانات المنطقة والمدينة ورقم القطعة والوحدة ورقم تسجيل الصك",
    "usage_ar": "يُستخدم في التحقق من الملكية قبل أي صفقة عقارية، ولازم لنقل الملكية وتسجيل الرهون والحجوزات وإجراءات التحكيم والقضاء المتعلقة بالعقار",
    "mandatory_in_ar": ["عقود البيع والشراء", "التسجيل في منظومة ريدز", "طلبات التمويل العقاري", "إجراءات الميراث والهبة والوقف"],
    "digital_platform_ar": "منظومة التسجيل العيني للعقار (ريدز) — وزارة العدل",
    "source_url": "https://www.moj.gov.sa/ar/eServices/Pages/REDS.aspx",
    "last_verified": "2026-05-21",
    "audience": ["مالك", "مستثمر", "وسيط", "مشتري"]
  },
  {
    "id": "national_address",
    "system_name_ar": "العنوان الوطني",
    "system_name_en": "National Address (Saudi Post)",
    "issuing_authority_ar": "شركة البريد السعودي (SPL)",
    "definition_ar": "نظام رسمي موحّد لتحديد وتوثيق عناوين جميع المباني والوحدات في المملكة العربية السعودية، تشغّله شركة البريد السعودي. يتكون من كود مرجعي مُدمج يشمل المنطقة والمدينة والحي والشارع ورقم المبنى والرمز البريدي والرقم الإضافي، ويُستخدم إلزامياً في توثيق العقود الرسمية والحكومية.",
    "definition_en": "A unified official system for identifying and documenting addresses of all buildings and units in Saudi Arabia, operated by Saudi Post (SPL). Comprises an integrated reference code covering region, city, district, street, building number, postal code, and additional code. Mandatorily used in official and government document filings.",
    "structure_ar": "الرمز البريدي (5 أرقام) + الرقم الإضافي (4 أرقام) + اسم الشارع + رقم المبنى + اسم الحي + اسم المدينة + المنطقة الإدارية",
    "usage_ar": "يُستخدم في تعريف موقع العقار في جميع العقود الرسمية والمراسلات الحكومية وطلبات الخدمات العامة وتوثيق عقود الإيجار في منصة إيجار وعقود البيع أمام كاتب العدل",
    "mandatory_in_ar": ["عقود الإيجار الموثقة في منصة إيجار", "عقود البيع أمام كاتب العدل", "طلبات الخدمات الحكومية", "تسجيل السجل التجاري للشركات"],
    "digital_platform_ar": "بوابة العنوان الوطني — شركة البريد السعودي (SPL)",
    "source_url": "https://splonline.com.sa/ar/national-address-1",
    "last_verified": "2026-05-21",
    "audience": ["مالك", "مستأجر", "مستثمر", "وسيط", "مطور"]
  },
  {
    "id": "district_code",
    "system_name_ar": "رمز الحي",
    "system_name_en": "District Code",
    "issuing_authority_ar": "وزارة الشؤون البلدية والقروية والإسكان",
    "definition_ar": "نظام ترقيم رسمي تُصدره وزارة الشؤون البلدية لكل حي سكني أو تجاري داخل النطاق العمراني للمدن السعودية. يُعرّف الحي بشكل فريد لأغراض التخطيط العمراني والتصنيف العقاري وإصدار التراخيص البلدية ورسم خرائط الخدمات.",
    "definition_en": "An official numbering system issued by the Ministry of Municipalities for every residential or commercial district within Saudi urban boundaries. Uniquely identifies each district for urban planning, real estate classification, municipal licensing, and service mapping purposes.",
    "structure_ar": "رمز رقمي أو أبجدي-رقمي يُحدد المنطقة الإدارية والمدينة ورقم الحي التسلسلي، ويرتبط بشبكة الخرائط البلدية الرقمية",
    "usage_ar": "يُستخدم في تصنيف العقارات ضمن خطط التقسيم البلدية، وفي إصدار التراخيص البنائية والتشغيلية، وفي ربط بيانات العقارات بالأحياء في منصات التسجيل الرسمية",
    "mandatory_in_ar": ["رخص البناء البلدية", "عقود الإيجار الموثقة", "تسجيل العناوين الوطنية"],
    "digital_platform_ar": "منصة بلدي — وزارة الشؤون البلدية والقروية",
    "source_url": "https://balady.gov.sa",
    "last_verified": "2026-05-21",
    "audience": ["مالك", "مستثمر", "مطور", "وسيط"]
  },
  {
    "id": "land_parcel_number",
    "system_name_ar": "رقم قطعة الأرض",
    "system_name_en": "Land Parcel Number",
    "issuing_authority_ar": "وزارة العدل — منظومة التسجيل العيني للعقار (ريدز)",
    "definition_ar": "معرّف فريد يُخصص لكل قطعة أرض في منظومة التسجيل العيني للعقار، يُحدد موقعها الجغرافي وحدودها ومساحتها بدقة في السجل العقاري الرقمي. يختلف عن رقم الصك التقليدي في أنه مرتبط بنظام المعلومات الجغرافية (GIS) ويُتيح التحقق الجغرافي الدقيق من حدود الأرض.",
    "definition_en": "A unique identifier assigned to each land plot in the Real Estate Electronic Registration System (REDS), precisely identifying its geographic location, boundaries, and area in the digital property registry. Differs from the traditional deed number in being linked to the GIS and enabling precise geographic verification of land boundaries.",
    "structure_ar": "رقم مرجعي فريد يُحدد: رقم المخطط + رقم القطعة داخل المخطط + رمز المنطقة والمدينة، مرتبط بإحداثيات GIS المعتمدة",
    "usage_ar": "يُستخدم للتحقق الجغرافي من حدود الأرض والتأكد من عدم التداخل مع قطع مجاورة، وهو أساسي في إجراءات التسجيل العيني ونقل الملكية وإصدار الصكوك الجديدة",
    "mandatory_in_ar": ["تسجيل العقارات في منظومة ريدز", "إجراءات نقل الملكية", "طلبات تقسيم أو دمج القطع"],
    "digital_platform_ar": "منظومة التسجيل العيني للعقار (ريدز) — وزارة العدل",
    "source_url": "https://www.moj.gov.sa/ar/eServices/Pages/REDS.aspx",
    "last_verified": "2026-05-21",
    "audience": ["مالك", "مستثمر", "وسيط", "مطور"]
  },
  {
    "id": "rega_property_code",
    "system_name_ar": "رمز التصنيف العقاري REGA",
    "system_name_en": "REGA Property Classification Code",
    "issuing_authority_ar": "الهيئة العامة للعقار (REGA)",
    "definition_ar": "نظام تصنيف عقاري رسمي تعتمده الهيئة العامة للعقار لتوحيد تصنيف العقارات والمنشآت العقارية في المنصات الرسمية كريدز ووافي وإيجار. يُمكّن من ربط البيانات العقارية بين المنصات الحكومية المختلفة ويُسهّل التحقق التلقائي من الامتثال التنظيمي.",
    "definition_en": "An official property classification system adopted by the Real Estate General Authority (REGA) to standardize the classification of properties and real estate facilities across official platforms such as REDS, Wafi, and Ejar. Enables cross-platform data linking between government systems and facilitates automated regulatory compliance verification.",
    "structure_ar": "كود هرمي يتكون من: فئة العقار (سكني/تجاري/زراعي/صناعي) + نوع الاستخدام + رمز المنطقة الجغرافية + رقم تسلسلي فريد",
    "usage_ar": "يُستخدم في منصات هيئة العقار للتحقق من امتثال العقارات لمتطلبات التسجيل والترخيص، وفي توحيد البيانات بين منظومة ريدز ومنصة وافي ومنصة إيجار",
    "mandatory_in_ar": ["تسجيل مشاريع التطوير في وافي", "إصدار تراخيص الوساطة العقارية", "الإفصاح في تقارير التقييم العقاري"],
    "digital_platform_ar": "منظومة ريدز، منصة وافي، منصة إيجار — الهيئة العامة للعقار (REGA)",
    "source_url": "https://www.rega.gov.sa/ar/services/real-estate-registration",
    "last_verified": "2026-05-21",
    "audience": ["مستثمر", "مالك", "مطور", "وسيط"]
  }
]
